[
  {
    "commonName": "Monstera Deliciosa",
    "latinName": "Monstera deliciosa",
    "lightPreference": "MEDIUM",
    "waterPreference": "MEDIUM",
    "humidityPreference": "MEDIUM",
    "toxicity": "TOXIC_PETS_AND_HUMANS",
    "difficulty": "EASY",
    "recommendedIndoor": true,
    "tags": ["climbing", "large", "tropical"],
    "shortDescription": "Popular tropical plant with large split leaves that develop distinctive holes as it matures. Grows quickly in bright indirect light and adapts well to indoor conditions.",
    "notes": "Provide a moss pole or support for climbing. Wipe leaves regularly to remove dust."
  },
  {
    "commonName": "Golden Pothos",
    "latinName": "Epipremnum aureum",
    "lightPreference": "MEDIUM",
    "waterPreference": "MEDIUM",
    "humidityPreference": "LOW",
    "toxicity": "TOXIC_PETS_AND_HUMANS",
    "difficulty": "EASY",
    "recommendedIndoor": true,
    "tags": ["hanging", "trailing", "air-purifying"],
    "shortDescription": "One of the easiest houseplants to grow with heart-shaped variegated leaves. Tolerates low light and occasional neglect exceptionally well.",
    "notes": "Trim regularly to encourage bushier growth. Can be propagated easily in water."
  },
  {
    "commonName": "Snake Plant",
    "latinName": "Sansevieria trifasciata",
    "lightPreference": "LOW",
    "waterPreference": "LOW",
    "humidityPreference": "LOW",
    "toxicity": "TOXIC_PETS",
    "difficulty": "EASY",
    "recommendedIndoor": true,
    "tags": ["succulent", "air-purifying", "drought-tolerant"],
    "shortDescription": "Extremely hardy plant with upright sword-like leaves featuring distinctive patterns. Tolerates neglect and survives in almost any light condition.",
    "notes": "Overwatering is the main cause of death. Allow soil to dry completely between waterings."
  },
  {
    "commonName": "ZZ Plant",
    "latinName": "Zamioculcas zamiifolia",
    "lightPreference": "LOW",
    "waterPreference": "LOW",
    "humidityPreference": "LOW",
    "toxicity": "TOXIC_PETS_AND_HUMANS",
    "difficulty": "EASY",
    "recommendedIndoor": true,
    "tags": ["drought-tolerant", "glossy"],
    "shortDescription": "Nearly indestructible plant with glossy dark green leaves that grow in graceful wand-like stems. Thrives on neglect and low light conditions.",
    "notes": "Rhizomes store water, so water sparingly. Yellow leaves indicate overwatering."
  },
  {
    "commonName": "Spider Plant",
    "latinName": "Chlorophytum comosum",
    "lightPreference": "MEDIUM",
    "waterPreference": "MEDIUM",
    "humidityPreference": "MEDIUM",
    "toxicity": "NON_TOXIC",
    "difficulty": "EASY",
    "recommendedIndoor": true,
    "tags": ["hanging", "air-purifying", "pet-safe"],
    "shortDescription": "Graceful arching foliage with green and white striped leaves that produce small plantlets on hanging stems. Safe for pets and excellent for beginners.",
    "notes": "Brown tips indicate fluoride sensitivity or low humidity. Propagate easily from plantlets."
  },
  {
    "commonName": "Peace Lily",
    "latinName": "Spathiphyllum wallisii",
    "lightPreference": "LOW",
    "waterPreference": "HIGH",
    "humidityPreference": "HIGH",
    "toxicity": "TOXIC_PETS_AND_HUMANS",
    "difficulty": "EASY",
    "recommendedIndoor": true,
    "tags": ["flowering", "air-purifying"],
    "shortDescription": "Popular flowering plant with elegant white blooms and glossy dark green leaves. Thrives in low light and communicates water needs by drooping.",
    "notes": "Keep soil consistently moist but not soggy. Mist regularly for humidity."
  },
  {
    "commonName": "Fiddle Leaf Fig",
    "latinName": "Ficus lyrata",
    "lightPreference": "HIGH",
    "waterPreference": "MEDIUM",
    "humidityPreference": "MEDIUM",
    "toxicity": "TOXIC_PETS_AND_HUMANS",
    "difficulty": "HARD",
    "recommendedIndoor": true,
    "tags": ["large", "tree"],
    "shortDescription": "Dramatic statement plant with large violin-shaped leaves. Requires consistent care and dislikes being moved or environmental changes.",
    "notes": "Water when top 2 inches of soil are dry. Rotate regularly for even growth. Sensitive to drafts."
  },
  {
    "commonName": "Rubber Plant",
    "latinName": "Ficus elastica",
    "lightPreference": "MEDIUM",
    "waterPreference": "MEDIUM",
    "humidityPreference": "MEDIUM",
    "toxicity": "TOXIC_PETS_AND_HUMANS",
    "difficulty": "EASY",
    "recommendedIndoor": true,
    "tags": ["large", "glossy", "tree"],
    "shortDescription": "Bold plant with thick glossy leaves that can range from dark green to burgundy. Grows into an impressive indoor tree with proper care.",
    "notes": "Wipe leaves regularly to maintain shine. Prune to control height and encourage bushiness."
  },
  {
    "commonName": "Aloe Vera",
    "latinName": "Aloe vera",
    "lightPreference": "HIGH",
    "waterPreference": "LOW",
    "humidityPreference": "LOW",
    "toxicity": "TOXIC_PETS",
    "difficulty": "EASY",
    "recommendedIndoor": true,
    "tags": ["succulent", "medicinal"],
    "shortDescription": "Medicinal succulent with thick fleshy leaves containing soothing gel. Requires minimal care and bright light to thrive.",
    "notes": "Allow soil to dry completely between waterings. Gel can be used for minor burns and skin irritation."
  },
  {
    "commonName": "Jade Plant",
    "latinName": "Crassula ovata",
    "lightPreference": "HIGH",
    "waterPreference": "LOW",
    "humidityPreference": "LOW",
    "toxicity": "TOXIC_PETS",
    "difficulty": "EASY",
    "recommendedIndoor": true,
    "tags": ["succulent", "small"],
    "shortDescription": "Classic succulent with thick oval leaves and woody stems that resembles a miniature tree. Can live for decades with proper care.",
    "notes": "Water deeply but infrequently. Red edges on leaves indicate good sun exposure."
  },
  {
    "commonName": "Philodendron Brasil",
    "latinName": "Philodendron hederaceum 'Brasil'",
    "lightPreference": "MEDIUM",
    "waterPreference": "MEDIUM",
    "humidityPreference": "MEDIUM",
    "toxicity": "TOXIC_PETS_AND_HUMANS",
    "difficulty": "EASY",
    "recommendedIndoor": true,
    "tags": ["trailing", "hanging", "variegated"],
    "shortDescription": "Fast-growing trailing plant with heart-shaped leaves featuring striking lime-green variegation. Extremely easy to care for and propagate.",
    "notes": "Brighter light enhances variegation. Propagates easily from stem cuttings in water."
  },
  {
    "commonName": "Pinstripe Calathea",
    "latinName": "Calathea ornata",
    "lightPreference": "MEDIUM",
    "waterPreference": "HIGH",
    "humidityPreference": "HIGH",
    "toxicity": "NON_TOXIC",
    "difficulty": "HARD",
    "recommendedIndoor": true,
    "tags": ["pet-safe", "prayer-plant"],
    "shortDescription": "Stunning plant with dark green leaves featuring pink pinstripe patterns. Leaves fold up at night and requires high humidity to thrive.",
    "notes": "Use filtered or distilled water. Mist daily or use a humidifier. Avoid direct sunlight."
  },
  {
    "commonName": "String of Pearls",
    "latinName": "Senecio rowleyanus",
    "lightPreference": "HIGH",
    "waterPreference": "LOW",
    "humidityPreference": "LOW",
    "toxicity": "TOXIC_PETS_AND_HUMANS",
    "difficulty": "MEDIUM",
    "recommendedIndoor": true,
    "tags": ["succulent", "hanging", "trailing"],
    "shortDescription": "Unique succulent with cascading strands of bead-like leaves. Requires bright light and careful watering to prevent rot.",
    "notes": "Water from below to avoid wetting the pearls. Prune to encourage fuller growth."
  },
  {
    "commonName": "Boston Fern",
    "latinName": "Nephrolepis exaltata",
    "lightPreference": "MEDIUM",
    "waterPreference": "HIGH",
    "humidityPreference": "HIGH",
    "toxicity": "NON_TOXIC",
    "difficulty": "MEDIUM",
    "recommendedIndoor": true,
    "tags": ["hanging", "pet-safe", "air-purifying"],
    "shortDescription": "Classic fern with arching fronds covered in delicate leaflets. Requires consistent moisture and high humidity to prevent browning.",
    "notes": "Keep soil consistently moist. Mist daily or place on a pebble tray. Trim brown fronds."
  },
  {
    "commonName": "Bird of Paradise",
    "latinName": "Strelitzia reginae",
    "lightPreference": "HIGH",
    "waterPreference": "MEDIUM",
    "humidityPreference": "MEDIUM",
    "toxicity": "TOXIC_PETS_AND_HUMANS",
    "difficulty": "MEDIUM",
    "recommendedIndoor": true,
    "tags": ["large", "flowering", "tropical"],
    "shortDescription": "Dramatic tropical plant with large banana-like leaves. Can produce spectacular orange and blue flowers with sufficient light and maturity.",
    "notes": "Requires very bright light to flower indoors. Wipe dust from large leaves regularly."
  },
  {
    "commonName": "Dragon Tree",
    "latinName": "Dracaena marginata",
    "lightPreference": "MEDIUM",
    "waterPreference": "LOW",
    "humidityPreference": "LOW",
    "toxicity": "TOXIC_PETS",
    "difficulty": "EASY",
    "recommendedIndoor": true,
    "tags": ["tree", "air-purifying"],
    "shortDescription": "Slender tree-like plant with narrow arching leaves edged in red. Tolerates neglect and low light conditions exceptionally well.",
    "notes": "Sensitive to fluoride in tap water. Use filtered water if leaf tips turn brown."
  },
  {
    "commonName": "Christmas Cactus",
    "latinName": "Schlumbergera bridgesii",
    "lightPreference": "MEDIUM",
    "waterPreference": "MEDIUM",
    "humidityPreference": "MEDIUM",
    "toxicity": "NON_TOXIC",
    "difficulty": "EASY",
    "recommendedIndoor": true,
    "tags": ["succulent", "flowering", "pet-safe"],
    "shortDescription": "Popular flowering succulent with segmented trailing stems that produce vibrant blooms in winter. Blooms triggered by shorter days and cooler temperatures.",
    "notes": "Keep slightly moist during blooming. Reduce watering after flowering. Prefers being pot-bound."
  },
  {